{
  "name": "VFX Platform",
  "description": "VFX Platform build and QML/USD development environment",
  "version": "1.0.0",
  "modules": {
    "linux": ["zsh", "git", "docker", "python", "conda", "vfx", "vscode", "bazel"],
    "darwin": ["zsh", "git", "docker", "python", "conda", "vfx", "vscode", "bazel"],
    "windows": ["vfx", "vscode", "bazel"]
  },
  "subtypes": {
    "standard": {
      "description": "Standard C++ VFX Platform project (Imath/OpenEXR)",
      "scaffold": "vfx/standard"
    },
    "qml": {
      "description": "VFX project with Qt/QML and USD support",
      "scaffold": "vfx/qml",
      "variables": {
        "USE_QML": "ON",
        "USE_USD": "ON"
      }
    }
  },
  "variables": {
    "VFX_PLATFORM_YEAR": "2024",
    "CXX_STANDARD": "17",
    "PYTHON_VERSION": "3.11",
    "QT_VERSION": "6.5",
    "PYSIDE_VERSION": "6.5",
    "IMATH_VERSION": "3.1.9",
    "OPENEXR_VERSION": "3.2.1",
    "BOOST_VERSION": "1.86.0",
    "TBB_VERSION": "2021.12.0",
    "USD_VERSION": "24.11"
  },
  "toolkits": ["vfx-bootstrap"],
  "post_init": [
    "conda run -n vfx-build python -m builder.cli list"
  ]
}
